img,figure,caption
8ED4483A-58C6-4F76-BE59-C8CC6DCDB95E.jpeg, Ilustración 1, Creando un nuevo repositorio
0CEEBB8C-29FB-4B85-9932-CEF642777A8A.jpeg, Ilustración 2, Ingresar el nombre del repositorio "helloworld"
7A7B0072-71ED-42BD-B985-B0D35CF03A1F.jpeg, Ilustración 3, Establecer la configuración inicial (agregar un archivo README) y confirmar la creación del nuevo repositorio
F8DCC7EB-D497-426D-904F-6941E2C4B750.jpeg, Ilustración 4, Ahora se crea un nuevo repositorio llamado "helloworld" junto con su primer archivo (README.md)
8032B4CC-A9BD-4B4F-8DFB-EBE7326886DE.jpeg, Ilustración 5, Iniciar la carga de archivos en el repositorio de GitHub
8085E82C-304F-48EE-8AD6-3F941E31860B.jpeg, Ilustración 6, Arrastre y suelte los archivos que se cargarán en el cuadro central. O, alternativamente, haga clic en "choose your files" que abrirá una ventana de selección de archivos donde se pueden elegir los archivos a cargar
